"BYLINE","DATE","DATELINE","HEADLINE","LENGTH","PUBLICATION","SECTION","TITLE",
"","Dienstag 8. Mai 2018 ","","Wissen Kompakt; Medizin: Mehr Informationen über Ärzte gewünscht ++ Tiere: Australien will Koalas besser schützen ++ Studie: Migration: Verbitterte mit größeren Sorgen ++ Umwelt: Tourismus schädigt mehr als erwartet","","Die Welt","","",
"","Dienstag 8. Mai 2018 ","","Teambildung auf der Zugspitze; Die Führungen der Koalitionsfraktionen tagen in den Alpen. Offiziell geht es um Wohnungsbau- und Außenpolitik. Doch ausgerechnet der Gastgeber verursacht einige Misstöne","","Die Welt","","",
"","Dienstag 8. Mai 2018 ","","Nie war Orbáns Spielraum größer; Ungarns Regierungschef stellt seine Minister vor - besonders eine Personalie steht im Fokus: der neue Europakoordinator. Seine Ernennung ist ein Signal in Richtung Berlin","","Die Welt","","",
"","Montag 7. Mai 2018 ","","Politik Kompakt; Freiburg: Grüner OB abgewählt, Parteiloser kommt ++ Krankenkasse: Spahn gegen höhere Beiträge für Raucher ++ Bundeswehr: Beschaffungsamt fehlen die Mitarbeiter ++ Afghanistan: Viele Tote bei Anschlag auf Moschee","","Die Welt","","",
"","Montag 7. Mai 2018 ","",""Es wird niemals jeder Patient seinen Wunschtermin bekommen"; Per Gesetz will Gesundheitsminister Jens Spahn die Terminvergabe beim Facharzt verbessern. Das sei kein realistisches Ziel, kritisiert Ärztepräsident Frank Ulrich Montgomery. Er hat einen anderen Vorschlag","","Die Welt","","",
"","6. Mai 2018 ","","Der Norden bittet zur Kasse; Die von Ministerpräsident Söder versprochenen Millionen für das Riedberger Horn wecken Begehrlichkeiten in anderen Regionen. Sie fühlen sich vernachlässigt","","Welt am Sonntag","","",
"","6. Mai 2018 ","",""Ich bin ängstlicher als andere Mütter"; Ein Gespräch über Trauer, Kultur, Gott und Kosten mit Franziska Manterfeld. In vierter Generation leitet sie das Bestattungsinstitut Weidemann in Glinde","","Welt am Sonntag","","",
"","6. Mai 2018 ","","Sechs Kosmetiktipps für Sylt & Co; Die Chefinnen des Osdorfer Online-Shops "Niche Beauty" sprechen über ihre persönlichen Lieblingsprodukte","","Welt am Sonntag","","",
"","6. Mai 2018 ","","So legalisieren Sie Ihre Haushaltshilfe","","Welt am Sonntag","","",
"","6. Mai 2018 ","","Frost vor Zugspitzen-Gipfel; SPD wirft Unionsministern "Alleingänge, Pseudodebatten und Ego-Interventionen" vor","","Welt am Sonntag","","",
"","Samstag 5. Mai 2018 ","","Der übersehene Faktor für ein langes Leben; Reiche Menschen kommen leichter an Medikamente und bessere Therapien als arme. Trotzdem ist Wohlstand kein Garant für ein langes Leben. Bildung sei wichtiger, sagt Sozialstatistiker Wolfgang Lutz aus Österreich","","Die Welt","","",
"","Samstag 5. Mai 2018 ","","Die Zinsfalle; Beim Baukredit sollte man sich rechtzeitig um eine Anschlussfinanzierung bemühen. Wachsame Bankkunden profitieren dabei vom harten Wettbewerb. Wer sich nicht kümmert, dem drohen teure Überraschungen","","Die Welt","","",
"","Samstag 5. Mai 2018 ","","Trump besiegen; Bei den Wahlen im November entscheidet sich das Schicksal des Präsidenten - und das der USA. Gewinnen die Republikaner, droht die Verwandlung in eine autoritäre Republik. Triumphieren die Demokraten, steht die große Abrechnung an","","Die Welt","","",
"","Samstag 5. Mai 2018 ","","Liebste Wünsche zum 70.; Die Frauen-Union feiert ihr 70-Jähriges. Bei dem heutigen Festakt wird die Kanzlerin gratulieren. Wir tun es schon jetzt","","Die Welt","","",
"","Freitag 4. Mai 2018 ","",""Inkubationszeit der Moderne"; Der Leiter der Alten Nationalgalerie Ralph Gleis zur Bedeutung der Sammlung und der Mischung aus Tradition und Neuanfang","","Die Welt","","",
"","Freitag 4. Mai 2018 ","","Dax ändert nach Höhenflug wieder die Richtung; Adidas-Aktie fällt nach Zahlen an das Indexende","","Die Welt","","",
"","Donnerstag 3. Mai 2018 ","","Olaf Scholz stolpert über seine Fußnoten; Viele Genossen hatten sich gefreut, den Finanzminister stellen zu können. Schließlich ist er zuständig fürs Geldausgeben. Doch der erste Haushaltsentwurf löst Empörung aus","","Die Welt","","",
"","Montag 30. April 2018 ","","Tückisches Plus; Der Staat zahlt seit 2017 mehr Rente. Für 120.000 Senioren heißt das: sich um die Steuer kümmern","","Die Welt","","",
"","Montag 30. April 2018 ","","Brexit? Aber nicht mit iPhone; Ein Brief des EU-Parlaments an das britische Innenministerium, der WELT exklusiv vorliegt, offenbart schwere Mängel bei der nötigen Registrierung von EU-Bürgern","","Die Welt","","",
"","Montag 30. April 2018 ","",""Der Kämpfer hat Flügel bekommen"; Der kleine Alfie Evans stirbt in Liverpool","","Die Welt","","",
"","29. April 2018 ","","Vorsorge, wozu?; Einmal im Jahr zum allgemeinen Gesundheitscheck, außerdem Brust, Haut und Darm auf Krebs untersuchen lassen. Das soll ein langes, gesundes Leben garantieren. Doch nun melden Forscher Zweifel an","","Welt am Sonntag","","",
"","29. April 2018 ","","Alles für Steffi; Vor 25 Jahren verübte Günter Parche das Attentat auf Monica Seles. Für ihn blieb die Tat ohne gravierende Folgen. Die Tennisspielerin hat den 30. April 1993 noch immer nicht verarbeitet","","Welt am Sonntag","","",
"","29. April 2018 ","","Der Gämswurz als Ruhestörer","","Welt am Sonntag","","",
"","29. April 2018 ","",""Gesundheitsversorgung auf dem Land gefährdet"; Landkreis-Präsident Christian Bernreiter glaubt nicht an die Förderung, die die CSU ankündigt","","Welt am Sonntag","","",
"","29. April 2018 ","",""Ich mochte die Underdog-Rolle"; Tarek Müller ist Gründer von About You und laut "Forbes"-Magazin einer der vielversprechendsten jungen Unternehmer Europas. Sein Erfolgsrezept: Er tut, was er will","","Welt am Sonntag","","",
"","Samstag 28. April 2018 ","","Kartell der Gesetzlosen; Rund zweieinhalb Millionen Menschen in Deutschland verdienen ihren Lebensunterhalt komplett schwarz. Sie bilden eine parallele Wirtschaftswelt mit ganz eigenen Regeln","","Die Welt","","",
"","Samstag 28. April 2018 ","","Unkraut des Herzens; Zur Hölle mit der Natur: Claire-Louise Bennett flieht in ihrem Debütroman "Teich" in die Einsamkeit der irischen Provinz und läuft im Garten Amok","","Die Welt","","",
"","Freitag 27. April 2018 ","","Man lernt ja nie aus","","Die Welt","","",
"","Freitag 27. April 2018 ","","Politik Kompakt; Krankenversicherung: SPD stellt sich gegen Spahn ++ Berlin: Hartz IV soll es nur für Ältere geben ++ Schweden: König schlägt 700 Jahre alten Rekord ++ USA: Pompeo kommt, Jackson kommt nicht","","Die Welt","","",
"","Freitag 27. April 2018 ","","Der Mann, der die "Schneeweiße" in unser Leben brachte; Der jüdische Unternehmer Oscar Troplowitz steht nicht nur hinter dem Erfolg von Nivea, er war auch ein Reformer und Wohltäter für Frauen und Benachteiligte. Vor 100 Jahren starb er viel zu jung in Hamburg","","Die Welt","","",
"","Donnerstag 26. April 2018 ","","Wirtschaft Kompakt II; Sixt: Autovermieter will Gewinn steigern ++ Fachkräftemangel: Deutschlandweit fehlen 25.000 Pfleger ++ Stiftung Warentest: Bio-Katzenfutter ist nur "mangelhaft"","","Die Welt","","",
"","Mittwoch 25. April 2018 ","","Abzocke mit Zahnspangen; Jedes zweite Kind in Deutschland in Behandlung. Kritik vom Rechnungshof","","Die Welt","","",
"","Mittwoch 25. April 2018 ","","Leserbriefe","","Die Welt","","",
"","Mittwoch 25. April 2018 ","","Wirtschaft Kompakt I; Techniker Krankenkasse: Erste elektronische Patientenakte ++ Georg Fahrenschon: Ex-Sparkassenchef akzeptiert Strafbefehl ++ Henkel-Aufsichtsrat: Weibliche Doppelspitze ++ Luftfahrt: Branche profitiert vom Trend zum Fliegen","","Die Welt","","",
"","Dienstag 24. April 2018 ","","Ein kleiner Prinz!; Herzogin Kate und Prinz William bekommen ihr drittes Kind - und die Queen ihren sechsten Urenkel","","Die Welt","","",
"","22. April 2018 ","","PKV-Prämien werden Fall für die Politik","","Welt am Sonntag","","",
"","22. April 2018 ","",""Ich will, dass sich Arbeit lohnt"; Hubertus Heil (SPD) glaubt, dass die Rente trotz alternder und schrumpfender Bevölkerung sicher bleibt, wenn es der Regierung gelingt, Vollbeschäftigung zu schaffen. Außerdem will der Bundesarbeitsminister die Einhaltung des Mindestlohns künftig strenger kontrollieren","","Welt am Sonntag","","",
"","Samstag 21. April 2018 ","","Altruismus im Garten; Der Frühling kommt mit voller Wucht: Alle wollen sie raus, Menschen wie Pflanzen. Die Deutschen sind nicht mehr zu halten. Gabriella Pape weiß, warum","","Die Welt","","",
"","Freitag 20. April 2018 ","","Wissen Kompakt; Hunger: Jeder dritte Mensch ist fehlernährt ++ Psychologie: Dauer-Nein im Job hilft gegen Stress ++ Musik: Tasteninstrumente werden digitalisiert ++ Medizin: Männer scheuen sich vor dem Zahnarzt","","Die Welt","","",
"","Freitag 20. April 2018 ","","Dann fällt das Duschen diese Woche aus; Keine Zeit für die Pflege, gefälschte Dokumentationen: Eine Altenpflegerin berichtet über ihren Arbeitsalltag","","Die Welt","","",
"","Donnerstag 19. April 2018 ","","Aggressiver Macher; In den ersten Wochen im Amt hat sich Gesundheitsminister Jens Spahn als Experte für Hartz IV, Grenzsicherung, innere Sicherheit und Islam präsentiert. Nun fängt der Arbeitsalltag an - der Ton bleibt scharf","","Die Welt","","",
"","Mittwoch 18. April 2018 ","","Einmal Teilzeit und zurück; Minister Hubertus Heil will einen Rechtsanspruch auf befristete Arbeitszeitverkürzung einführen. Die Regelung gilt nicht für kleine Firmen","","Die Welt","","",
"","Dienstag 17. April 2018 ","","Sorgen Sie für mehr Wettbewerb, Herr Spahn!","","Die Welt","","",
"","Montag 16. April 2018 ","","Finanzen Kompakt; Banken: Immer weniger Geldautomaten ++ Pilotprojekt: Bargeld: Boten helfen Senioren ++ Studium: Nicht mehr als 20 Stunden jobben ++ Kryptogeld: PC muss vor Schürfern geschützt werden","","Die Welt","","",
"","Montag 16. April 2018 ","","Aus dem Kuckucksnest geflogen; Der Tscheche Milos Forman musste seine Heimat verlassen und machte im Westen Karriere mit Filmen über Nonkonformisten. Nun ist der doppelte Oscar-Gewinner mit 86 Jahren gestorben","","Die Welt","","",
"","Montag 16. April 2018 ","","Wirtschaft Kompakt II; Bundesregierung: Senkung der Sozialbeiträge geplant ++ Starbucks: Chef entschuldigt sich nach Festnahme ++ Öffentlicher Dienst: Bewegung im Tarifstreit ++ Immobilienmarkt: 10.000 Menschen gegen steigende Mieten","","Die Welt","","",
"","15. April 2018 ","","Spendabler Kümmerer","","Welt am Sonntag","","",
"","15. April 2018 ","","Nächstes Jahr Senkung der Sozialbeiträge","","Welt am Sonntag","","",
"","15. April 2018 ","",""Arbeit ist mehr als Verdienst und Broterwerb"; DGB-Chef Reiner Hoffmann ist Deutschlands oberster Gewerkschafter. Ein Gespräch über die größten Hürden auf dem Weg zur Vollbeschäftigung, die Streiklust der Deutschen und neue Verteilungskämpfe in Zeiten der Digitalisierung","","Welt am Sonntag","","",
"","Samstag 14. April 2018 ","","Es ist Zeit für Bauch, Beine, Po!; Bei der Barmer, der zweitgrößten Krankenkasse des Landes, soll Regina Vetters die Digitalisierung vorantreiben - zum Beispiel mit Vorsorge-Apps. Strenge Regeln setzen ihr dabei allerdings Grenzen","","Die Welt","","",
"","Samstag 14. April 2018 ","","Minenfeld Heimat; Die alteingesessenen Parteien wollen das Schlagwort der populistischen Rechten entreißen. Doch in Nordrhein-Westfalen ist zu besichtigen, wie schwierig das ist","","Die Welt","","",
"","Samstag 14. April 2018 ","","Trump will mehr Geld von Amazon; Die US-Post hat finanzielle Probleme. Der Präsident macht dafür den Technologie-Giganten verantwortlich. Die Vorwürfe sind wohl falsch, passen aber in seine Kampagne gegen den Konzern","","Die Welt","","",
"","Freitag 13. April 2018 ","","Im Wochenendkurs Soldat werden; Der Bundeswehr fehlen Reservisten. Jetzt sollen ungediente Zivilisten im Schnellverfahren militärisch ausgebildet werden. Dauer: 178 Stunden","","Die Welt","","",
"","Donnerstag 12. April 2018 ","","Wissen Kompakt; Erderwärmung: Wenig Schnee ist gut für die Alpen ++ Blinddarmentzündung: Bei Kindern keine Operation nötig ++ Psychotherapie: Fünf Monate Warten auf Behandlung ++ neue Apps: Hilfe für psychisch belastete Flüchtlinge","","Die Welt","","",
"","Donnerstag 12. April 2018 ","","Tag 29","","Die Welt","","",
"","Mittwoch 11. April 2018 ","",""Der Maßstab ist westdeutsch, davon müssen wir wegkommen"; SPD-Ostbeauftragter Dulig über Unterschiede im Demokratiebild und den Abstieg seiner Partei","","Die Welt","","",
"","Mittwoch 11. April 2018 ","","Wirtschaft Kompakt I; Arbeitnehmer: Die meisten sind vom Job gestresst ++ Nord Stream 2: Merkel: Transit durch Ukraine soll bleiben ++ Personenbeförderung: Verbot durch EU-Staaten zulässig ++ Digitalisierung: Hälfte der Deutschen immer "online"","","Die Welt","","",
"","Dienstag 10. April 2018 ","","Was bei der SPD fehlt","","Die Welt","","",
"","Montag 9. April 2018 ","",""Leerer Populismus, von dem nichts Realität wird"; Im Streit über Familiennachzug und Islam wirft SPD-Vize Ralf Stegner der CSU vor, die Parolen der AfD zu übernehmen. Und er sagt, der Bundesinnenminister habe das Grundgesetz nicht verstanden","","Die Welt","","",
"","Montag 9. April 2018 ","","Finanzen Kompakt; Frankreich: Lottogesellschaft soll an die Börse ++ Finanz-Start-ups: Rekordsumme von Investoren eingeworben ++ Norwegen: Mehr Geld in Solar- und Windparks ++ Krankschreibung: Arbeitnehmer trägt Risiko für Eingang ++ Otto: About-You-Börsengang nicht ausgeschlossen","","Die Welt","","",
"","8. April 2018 ","","Bis zum nächsten Völkermord; Den Regimes in Afrika ist es egal, ob ihre Bürger im Mittelmeer ertrinken. Die Revolutionserwartung des Jahres 1968 für dieDritte Welt war ein blutiger Irrtum, meint Hans Christoph Buch","","Welt am Sonntag","","",
"","8. April 2018 ","","Die Ungarn wählen, doch eine Wahl haben sie nicht","","Welt am Sonntag","","",
"","8. April 2018 ","","Schlamm drüber!; Morgens Fango, abends Tango: Kururlaub im Teutoburger Wald galt lange als spießig, nach der Gesundheitsreform siechte er dahin. Nun lebt er neu auf - mit Medical Health und Mädels-Wochenenden","","Welt am Sonntag","","",
"","Samstag 7. April 2018 ","","Lasst die Dicken in Ruhe; Durch Deutschland verläuft ein Riss: Dicke gegen Dünne. Die Übergewichtigen sind dabei deutlich im Nachteil, sie gelten als faul und antriebsschwach. Aber stimmt das wirklich?","","Die Welt","","",
"","Samstag 7. April 2018 ","","So wird es wieder grün; Später Frost und feuchte Wintermonate haben vielen Rasenflächen zu schaffen gemacht. Umso wichtiger ist jetzt die richtige Pflege. Dabei machen Hobbygärtner oft einige Fehler","","Die Welt","","",
"","Samstag 7. April 2018 ","","Acht Jahre Orbán sind vielen genug; Ungarns Premier und seine Partei führen in Umfragen vor der Wahl am Sonntag. Aber eine entscheidende Gruppe wird ihm nun gefährlich","","Die Welt","","",
"","Freitag 6. April 2018 ","","Wirtschaft Kompakt II; Spanien: HSBC-Hinweisgeber Falciani wieder frei ++ USA: Seit 2008 höchstes Handelsdefizit ++ Ikea: Innenstädte statt grüner Wiese ++ Nord Stream 2: Finnische Regierung genehmigt Pipeline ++ Pflege: Betreuende Angehörige zum Drittel Männer ++ Erneuerbare Energien: Fast die Hälfte der Investitionen in China","","Die Welt","","",
"","Donnerstag 5. April 2018 ","","Ärzte machen Fehler, doch die Quote sinkt; Trotz Zeit- und Kostendruck gibt es weniger Grund zur Klage als 2016. Die meisten Probleme treten in der Orthopädie auf","","Die Welt","","",
"","Donnerstag 5. April 2018 ","","Ich. Ich. Ich. Ist genau richtig!; Die Psychologin Christine Brähler hat eine interessante These entwickelt: Nachsichtiger Umgang mit sich selbst bringt am meisten","","Die Welt","","",
"","Donnerstag 5. April 2018 ","","Warum Jeremy Corbyn Labour die Machtübernahme kosten könnte; Die britische Linke erlebte einen Höhenflug. Doch der Skandal um antisemitische Ausfälle zeigt, wie der Parteichef seine politische Glaubwürdigkeit verspielt","","Die Welt","","",
"","1. April 2018 ","","Spahn will Ausländer holen","","Welt am Sonntag","","",
"","1. April 2018 ","","Fast die Hälfte aller deutschen Hirnhautentzündungen in Bayern; Bayern ist Meningitis-Risikogebiet. Die von Zecken übertragene Infektion kann tödlich enden. Doch gerade bei Kindern klafft eine enorme Impflücke","","Welt am Sonntag","","",
"","1. April 2018 ","","Doktor Klartext; Ratgeber-Videos haben Johannes Wimmer zu einem bekannten Internet-Arzt gemacht. Seine Botschaft: Wer seltener zu Medizin greift, lebt gesünder","","Welt am Sonntag","","",
"","Samstag 31. März 2018 ","",""Alles, aber kein Wundermittel"; IW-Chef Hüther kritisiert die Idee eines solidarischen Grundeinkommens","","Die Welt","","",
"","Samstag 31. März 2018 ","","Die 10 größten Irrtümer bei der Steuererklärung; Es ist Zeit für das jährliche Ritual mit dem Finanzamt. Frank Stocker erklärt, wie kostspielige Fallen umgangen werden können","","Die Welt","","",
"","Donnerstag 29. März 2018 ","","Keine Lust mehr auf simple Pillen; Novartis trennt sich von dem Geschäft mit rezeptfreien Medikamenten. Andere Hersteller versuchen das auch. Branchenfremde Firmen zeigen Interesse","","Die Welt","","",
"","Montag 26. März 2018 ","","Ringen um den Pflegegrad; Dauert die Entscheidung über Pflegebedürftigkeit länger als 25 Tage, wird eine Entschädigung fällig. Was Betroffene wissen sollten","","Die Welt","","",
"","Montag 26. März 2018 ","","Finanzen Kompakt; Leiharbeit: Richter stärken Kündigungsschutz ++ Arbeitsunfähigkeit: Bescheinigung des Reha-Arztes zählt ++ Betriebsrente: Anspruch gilt auch rückwirkend","","Die Welt","","",
"","Montag 26. März 2018 ","","Wenn der Kollege zum Feind wird; Mobbing ist Alltag in vielen deutschen Unternehmen. Doch wer angegriffen wird, kann sich wehren. Ein Therapeut über Gegenmaßnahmen - und die entscheidende Rolle des Chefs","","Die Welt","","",
"","25. März 2018 ","","Entscheiden müssen wir, auch ohne Steuerrad","","Welt am Sonntag","","",
"","25. März 2018 ","",""Haben Sie nie mit Gott gehadert?"; Michel-Hauptpastor Alexander Röder erklärt, warum in seiner Kirche zu Palmsonntag ein Adventslied gesungen wird und wie er selbst zur Theologie fand","","Welt am Sonntag","","",
"","25. März 2018 ","","Psychotraumatologie","","Welt am Sonntag","","",
"","25. März 2018 ","",""Daten für bessere Gesundheit nutzen"; Beim Gesundheitskonzern Fresenius Medical Care ist Big Data längst ein Geschäftsmodell. Sogar die Wahrscheinlichkeit für einen Herzinfarkt lässt sich vorhersagen. Schwieriger ist die Prognose der Gesundheitspolitik - und des nächsten Tweets von Trump","","Welt am Sonntag","","",
"","Samstag 24. März 2018 ","","Drei Gesetze bis zum Sommer; Im Gesundheitsministerium soll es jetzt schnell gehen","","Die Welt","","",
"","Samstag 24. März 2018 ","","Dilemma des modernen Menschen; Der neue Gesundheitsminister geht an Grenzen - auch an seine eigenen. Jens Spahn ist ein Mensch zwischen Vergangenheit und Zukunft, zwischen Toleranz und Tabula rasa. Gesund ist das nicht immer","","Die Welt","","",
"","Samstag 24. März 2018 ","","Psychotraumatologie","","Die Welt","","",
"","Samstag 24. März 2018 ","","Nichts als die Wahrheit; Jalid Sehouli ist Direktor der Frauenklinik an der Berliner Charité und Experte dafür, wie man schlechte Nachrichten möglichst gut überbringt. Authentisch, menschlich und absolut ehrlich sollte man sein, sagt er - das sei trotz Zeitmangels immer möglich","","Die Welt","","",
"","Freitag 23. März 2018 ","","Debeka ist der große Sieger; Ein aktuelles Ranking offenbart, bei welchen privaten Krankenversicherern die Kunden gut aufgehoben sind","","Die Welt","","",
"","Donnerstag 22. März 2018 ","","Wissen Kompakt; Krebs: Plasma-Einsatz zeigt erste Erfolge ++ Gesundheit: Heiße Rolle kann Schmerzen lindern ++ Pilzinfektionen durch starke Intimhygiene ++ Botanik: Sonnenblumen spielen miteinander","","Die Welt","","",
"","Mittwoch 21. März 2018 ","","Zippert zappt","","Die Welt","","",
"","Mittwoch 21. März 2018 ","","Renten steigen in Ost und West um gut drei Prozent; Grund für das Plus ist die gute Lage am Arbeitsmarkt","","Die Welt","","",
"","Mittwoch 21. März 2018 ","","Der Vierundsiebzigjährige, der aus dem Fenster stieg; Romeo und Julia leben jetzt im Altersheim: Luk Perceval debütiert am Wiener Burgtheater mit "Rosa oder Die barmherzige Erde"","","Die Welt","","",
"","Dienstag 20. März 2018 ","",""Manche Trainer haben Angst"; Nicklas Dietrich und Yann-Benjamin Kugel zählen zu den besten Fitmachern Deutschlands. Im Interview verraten sie ihre erfolgreichsten Tricks und erklären die Geheimnisse des Fußball-Nationalteams drei Monate vor dem Start der Weltmeisterschaft","","Die Welt","","",
"","Montag 19. März 2018 ","","Frauen sind nicht tough genug","","Die Welt","","",
"","Montag 19. März 2018 ","","Brexit gefährdet die Gesundheit; Mehr Geld für britische Krankenhäuser, versprachen einst Befürworter des Austritts. Jetzt zeigt sich: Statt besser wird die Gesundheitsversorgung schlechter. Ein großes Problem ist der Personalmangel","","Die Welt","","",
"","Montag 19. März 2018 ","","Wissen Kompakt; Tiere: Bleimunition vergiftet gefährdete Geier ++ Umwelt: Wassermangel bedroht halbe Erde ++ Digitalisierung: Hausärzte fühlen sich ausgebremst ++ Gesundheit: Alkoholkonsum seit 2007 leicht gesunken","","Die Welt","","",
"","Montag 19. März 2018 ","","Politiker aus Union und SPD von GroKo-Ministern genervt; Polarisierende Äußerungen von Seehofer und Spahn sorgen für Unmut in der Koalition. Sozialdemokraten vermuten Profilierungsversuche. Auch in der CDU gibt es die Forderung, mit der Sacharbeit zu starten","","Die Welt","","",
"","Montag 19. März 2018 ","","Ich meine aber; Der von der Koalition versprochene Einstieg in die Sacharbeit ist misslungen. Union und SPD führen erst mal Grundsatzdebatten. Der Modus "Wahlkampf" muss offenbar erst mal wieder abgeschaltet werden","","Die Welt","","",
"","18. März 2018 ","","Ist ja gut!","","Welt am Sonntag","","",
"","18. März 2018 ","",""Nicht heilbar, aber beherrschbar"; Hartmut Juhl, der Mitbegründer von Indivumed, treibt die individuelle Behandlung von Tumorpatienten voran. Die wachsende Datenbank des Unternehmens hilft, die Entwicklung neuer Medikamente zu beschleunigen","","Welt am Sonntag","","",
"","18. März 2018 ","","Das Kreuz mit dem Rücken","","Welt am Sonntag","","",
"","18. März 2018 ","","Alt, gierig, männlich; Vorbei ist die Zeit, in der Aktionäre eine miese Besetzung der Kontrollgremien schweigend hinnahmen. Vor allem bei der Deutsche-Bank-Tochter DWS ist Protest programmiert","","Welt am Sonntag","","",
"","18. März 2018 ","","Wenn der Banker den Gärtner bucht; Um Filialen auf dem Land am Leben zu halten, testen Volksbanken neue Einnahmequellen. Bankberater werden für Kunden zu persönlichen Assistenten","","Welt am Sonntag","","",
"","18. März 2018 ","","Mehr auf den Schreibtisch; Die Digitalisierung macht den Schreibtisch beinahe überflüssig. Das ist schade und falsch. Mit der richtigen Ausstattung arbeitet es sich an diesem Ort noch immer effizient","","Welt am Sonntag","","",
"","Samstag 17. März 2018 ","","Dreampopper; Markus Söder ist nun, was er immer werden wollte: Ministerpräsident von Bayern. Spielte er früher meist Punk, ist er jetzt ruhiger. Wer spielt in seiner Begleitband?","","Die Welt","","",
"","Samstag 17. März 2018 ","","Ich, einfach verbesserlich; Larry Smarr hat einen digitalisierten Körper, er vermisst seinen Darm, seinen Blutdruck, seine Hormone. Er plante sogar seine eigene Operation. Heute hat er weltweit Jünger, die sich penibel selbst überwachen","","Die Welt","","",
"","Samstag 17. März 2018 ","","Vergesst die Unternehmen nicht","","Die Welt","","",
"","Freitag 16. März 2018 ","","Deutschland hat Rücken; Drei von vier Beschäftigten sind bereits betroffen","","Die Welt","","",
"","Freitag 16. März 2018 ","","Wirtschaft Kompakt I; Pflegeversicherung: Jahresabschluss mit roten Zahlen ++ Gesundheitskarte: Spahn verspricht schnelle Einführung ++ EU-Kommission: Bezeichnung Beelitzer Spargel geschützt ++ Autobauer: Mehr Neuwagen in Europa zugelassen","","Die Welt","","",
"","Donnerstag 15. März 2018 ","","Killer im Bauch; Es ist kaum spürbar und brandgefährlich: Tausende Menschen in Deutschland, vor allem Männer, haben ein Aneurysma","","Die Welt","","",
"","Donnerstag 15. März 2018 ","","Und Gabriel spricht ausnahmsweise von Demut; Bei der Amtsübergabe an Heiko Maas ist dem scheidenden Außenminister anzumerken, wie schwer ihm der Abschied fällt","","Die Welt","","",
"","Donnerstag 15. März 2018 ","","Kandidat der Demokraten erobert Republikaner-Hochburg; Nachwahl in Pennsylvania: Conor Lamb erklärt sich zum Sieger. Seine Strategie im Wahlkampf ist ein Lehrstück für beide Parteien","","Die Welt","","",
